{
  "$schema": "https://json-schema.org/draft/2020-12/schema",
  "$id": "https://soma-guide.netlify.app/schema/soma-app-v1.schema.json",
  "title": "SOMA app manifest v1",
  "type": "object",
  "required": [
    "schema_version",
    "app",
    "hosts",
    "guide",
    "identity",
    "concepts",
    "questions",
    "actions",
    "workflows",
    "ai_visitors",
    "promises",
    "data_flows",
    "data_stores",
    "legal",
    "credits",
    "dependencies"
  ],
  "additionalProperties": false,
  "properties": {
    "$schema": { "type": "string", "minLength": 1 },
    "schema_version": { "const": "soma.app/1" },
    "app": {
      "type": "object",
      "required": ["id", "name", "tier", "origins", "repository"],
      "additionalProperties": false,
      "properties": {
        "id": { "$ref": "#/$defs/appId" },
        "name": { "$ref": "#/$defs/nonEmptyString" },
        "description": { "$ref": "#/$defs/nonEmptyString" },
        "tier": { "enum": ["prototype", "public-mvp"] },
        "origins": {
          "type": "object",
          "required": ["production", "staging"],
          "additionalProperties": false,
          "properties": {
            "production": { "$ref": "#/$defs/httpsOrigin" },
            "staging": { "$ref": "#/$defs/httpsOrigin" }
          }
        },
        "repository": {
          "type": "string",
          "pattern": "^[A-Za-z0-9_.-]+/[A-Za-z0-9_.-]+$"
        }
      }
    },
    "hosts": {
      "type": "object",
      "required": ["human", "ai"],
      "additionalProperties": false,
      "properties": {
        "human": {
          "type": "object",
          "required": ["id", "name", "role", "escalation_url", "expected_response"],
          "additionalProperties": false,
          "properties": {
            "id": { "$ref": "#/$defs/id" },
            "name": { "$ref": "#/$defs/nonEmptyString" },
            "role": { "$ref": "#/$defs/nonEmptyString" },
            "escalation_url": { "$ref": "#/$defs/route" },
            "expected_response": { "$ref": "#/$defs/nonEmptyString" }
          }
        },
        "ai": {
          "type": "object",
          "required": ["id", "name", "role", "persona"],
          "additionalProperties": false,
          "properties": {
            "id": { "$ref": "#/$defs/id" },
            "name": { "$ref": "#/$defs/nonEmptyString" },
            "role": { "$ref": "#/$defs/nonEmptyString" },
            "persona": { "$ref": "#/$defs/sourcePath" }
          }
        }
      }
    },
    "guide": {
      "type": "object",
      "required": ["ask", "voice"],
      "additionalProperties": false,
      "properties": {
        "ask": {
          "type": "object",
          "required": ["knowledge", "page_context", "web"],
          "additionalProperties": false,
          "properties": {
            "knowledge": {
              "type": "array",
              "items": { "$ref": "#/$defs/sourcePath" },
              "uniqueItems": true
            },
            "page_context": { "type": "boolean" },
            "web": { "type": "boolean" }
          }
        },
        "voice": {
          "type": "object",
          "required": ["enabled"],
          "additionalProperties": false,
          "properties": {
            "enabled": { "type": "boolean" }
          }
        }
      }
    },
    "identity": {
      "type": "object",
      "required": ["subject", "admission", "profile_fields"],
      "additionalProperties": false,
      "properties": {
        "subject": { "enum": ["pairwise", "legacy-global"] },
        "admission": { "enum": ["open", "invitation", "request"] },
        "profile_fields": {
          "type": "array",
          "items": { "$ref": "#/$defs/id" },
          "uniqueItems": true
        },
        "email_reason": { "$ref": "#/$defs/nonEmptyString" },
        "legacy_auth_storage_keys": {
          "type": "array",
          "minItems": 1,
          "items": { "$ref": "#/$defs/storageKey" },
          "uniqueItems": true
        }
      },
      "allOf": [
        {
          "if": {
            "properties": { "subject": { "const": "legacy-global" } },
            "required": ["subject"]
          },
          "then": {
            "required": ["legacy_auth_storage_keys"],
            "properties": { "legacy_auth_storage_keys": true }
          },
          "else": {
            "properties": { "legacy_auth_storage_keys": false }
          }
        },
        {
          "if": {
            "properties": {
              "profile_fields": {
                "type": "array",
                "contains": { "const": "email" }
              }
            },
            "required": ["profile_fields"]
          },
          "then": {
            "required": ["email_reason"],
            "properties": { "email_reason": true }
          },
          "else": {
            "properties": { "email_reason": false }
          }
        }
      ]
    },
    "concepts": {
      "type": "array",
      "items": { "$ref": "#/$defs/concept" }
    },
    "questions": {
      "type": "array",
      "items": { "$ref": "#/$defs/question" }
    },
    "actions": {
      "type": "array",
      "items": { "$ref": "#/$defs/action" }
    },
    "workflows": {
      "type": "array",
      "items": { "$ref": "#/$defs/workflow" }
    },
    "ai_visitors": {
      "type": "object",
      "required": ["enabled", "default_grant_minutes", "maximum_standing_risk"],
      "additionalProperties": false,
      "properties": {
        "enabled": { "type": "boolean" },
        "default_grant_minutes": { "type": "integer", "minimum": 1 },
        "maximum_standing_risk": {
          "enum": ["observe", "reversible", "consequential"]
        },
        "stranger_test_action": { "$ref": "#/$defs/actionId" }
      },
      "if": {
        "properties": { "enabled": { "const": true } },
        "required": ["enabled"]
      },
      "then": {
        "required": ["stranger_test_action"],
        "properties": { "stranger_test_action": true }
      },
      "else": {
        "properties": { "stranger_test_action": false }
      }
    },
    "promises": {
      "type": "array",
      "items": {
        "type": "object",
        "required": ["id", "text", "check"],
        "additionalProperties": false,
        "properties": {
          "id": { "$ref": "#/$defs/id" },
          "text": { "$ref": "#/$defs/nonEmptyString" },
          "check": { "$ref": "#/$defs/nonEmptyString" }
        }
      }
    },
    "data_flows": {
      "type": "array",
      "items": {
        "type": "object",
        "required": ["vendor", "what", "why", "retention_days"],
        "additionalProperties": false,
        "properties": {
          "vendor": { "$ref": "#/$defs/nonEmptyString" },
          "what": { "$ref": "#/$defs/nonEmptyString" },
          "why": { "$ref": "#/$defs/nonEmptyString" },
          "secret_env": {
            "type": "string",
            "pattern": "^[A-Z][A-Z0-9_]*$"
          },
          "retention_days": {
            "oneOf": [
              { "type": "integer", "minimum": 0 },
              { "const": "undeclared" }
            ]
          }
        }
      }
    },
    "data_stores": {
      "type": "array",
      "items": {
        "type": "object",
        "required": [
          "id",
          "owner",
          "kind",
          "data_classes",
          "export",
          "erase",
          "retention",
          "lawful_exception"
        ],
        "additionalProperties": false,
        "properties": {
          "id": { "$ref": "#/$defs/id" },
          "owner": { "$ref": "#/$defs/id" },
          "kind": {
            "enum": ["database", "object-storage", "notification", "provider"]
          },
          "data_classes": {
            "type": "array",
            "minItems": 1,
            "items": { "$ref": "#/$defs/id" },
            "uniqueItems": true
          },
          "export": { "$ref": "#/$defs/sourcePath" },
          "erase": { "$ref": "#/$defs/sourcePath" },
          "retention": { "$ref": "#/$defs/nonEmptyString" },
          "lawful_exception": { "type": "boolean" }
        }
      }
    },
    "legal": {
      "type": "object",
      "required": [
        "operator",
        "privacy",
        "terms",
        "data_export",
        "app_forget",
        "agent_revocation"
      ],
      "additionalProperties": false,
      "properties": {
        "operator": { "$ref": "#/$defs/nonEmptyString" },
        "privacy": { "$ref": "#/$defs/route" },
        "terms": { "$ref": "#/$defs/route" },
        "data_export": { "$ref": "#/$defs/route" },
        "app_forget": { "$ref": "#/$defs/route" },
        "agent_revocation": { "$ref": "#/$defs/route" },
        "privacy_source": { "$ref": "#/$defs/sourcePath" },
        "terms_source": { "$ref": "#/$defs/sourcePath" },
        "ratified_by": { "$ref": "#/$defs/nonEmptyString" },
        "ratified_at": {
          "type": "string",
          "pattern": "^\\d{4}-\\d{2}-\\d{2}T\\d{2}:\\d{2}:\\d{2}(?:\\.\\d+)?Z$"
        }
      }
    },
    "credits": {
      "type": "object",
      "required": ["page", "require_artifact_byline"],
      "additionalProperties": false,
      "properties": {
        "page": { "$ref": "#/$defs/route" },
        "require_artifact_byline": { "type": "boolean" }
      }
    },
    "dependencies": {
      "type": "object",
      "required": ["identity_broker", "guide_cdn"],
      "additionalProperties": false,
      "properties": {
        "identity_broker": { "$ref": "#/$defs/dependency" },
        "guide_cdn": { "$ref": "#/$defs/dependency" }
      }
    }
  },
  "allOf": [
    {
      "if": {
        "properties": {
          "app": {
            "type": "object",
            "properties": { "tier": { "const": "public-mvp" } },
            "required": ["tier"]
          }
        },
        "required": ["app"]
      },
      "then": {
        "properties": {
          "legal": {
            "type": "object",
            "required": [
              "privacy_source",
              "terms_source",
              "ratified_by",
              "ratified_at"
            ],
            "properties": {
              "privacy_source": true,
              "terms_source": true,
              "ratified_by": true,
              "ratified_at": true
            }
          },
          "data_flows": {
            "type": "array",
            "items": {
              "type": "object",
              "properties": {
                "retention_days": {
                  "type": "integer",
                  "minimum": 0
                }
              }
            }
          }
        }
      }
    }
  ],
  "$defs": {
    "nonEmptyString": {
      "type": "string",
      "minLength": 1
    },
    "appId": {
      "type": "string",
      "maxLength": 40,
      "pattern": "^[a-z][a-z0-9]*(?:-[a-z0-9]+)*$"
    },
    "id": {
      "type": "string",
      "minLength": 1,
      "pattern": "^[A-Za-z0-9][A-Za-z0-9:._-]*$"
    },
    "storageKey": {
      "type": "string",
      "minLength": 1,
      "oneOf": [
        {
          "pattern": "^(?!\\^)[^\\p{Cc}]+$"
        },
        {
          "pattern": "^\\^[^\\p{Cc}]+\\$$"
        }
      ]
    },
    "actionId": {
      "type": "string",
      "pattern": "^(?!soma\\.)[a-z][a-z0-9-]*(?:\\.[a-z][a-z0-9-]*)+$"
    },
    "sourcePath": {
      "type": "string",
      "minLength": 1,
      "pattern": "^(?!/)(?!.*(?:^|/)\\.\\.?(?:/|$))(?!.*//)(?![A-Za-z][A-Za-z0-9+.-]*:)(?!.*[\\\\\\p{Cc}]).+(?<!/)$"
    },
    "route": {
      "type": "string",
      "pattern": "^/(?!/)(?:[^\\u0000-\\u001F\\u007F?#])*$"
    },
    "httpsOrigin": {
      "type": "string",
      "pattern": "^https://[A-Za-z0-9.-]+(?::[0-9]+)?$"
    },
    "concept": {
      "type": "object",
      "required": ["id", "version", "title", "tell", "show"],
      "additionalProperties": false,
      "properties": {
        "id": { "$ref": "#/$defs/id" },
        "version": { "$ref": "#/$defs/nonEmptyString" },
        "title": { "$ref": "#/$defs/nonEmptyString" },
        "tell": { "$ref": "#/$defs/sourcePath" },
        "show": { "$ref": "#/$defs/id" }
      }
    },
    "question": {
      "type": "object",
      "required": ["id", "schema_version", "portable"],
      "additionalProperties": false,
      "properties": {
        "id": { "$ref": "#/$defs/id" },
        "schema_version": { "$ref": "#/$defs/nonEmptyString" },
        "portable": { "type": "boolean" }
      }
    },
    "executor": {
      "oneOf": [
        {
          "type": "object",
          "required": ["kind", "name"],
          "additionalProperties": false,
          "properties": {
            "kind": { "const": "rpc" },
            "name": {
              "type": "string",
              "pattern": "^[a-z][a-z0-9_]*$"
            }
          }
        },
        {
          "type": "object",
          "required": ["kind", "provider", "operation"],
          "additionalProperties": false,
          "properties": {
            "kind": { "const": "external" },
            "provider": { "$ref": "#/$defs/nonEmptyString" },
            "operation": { "$ref": "#/$defs/nonEmptyString" }
          }
        }
      ]
    },
    "action": {
      "type": "object",
      "required": [
        "id",
        "version",
        "kind",
        "required_scopes",
        "required_role",
        "surfaces",
        "input_schema",
        "output_schema",
        "effects"
      ],
      "additionalProperties": false,
      "properties": {
        "id": { "$ref": "#/$defs/actionId" },
        "version": { "$ref": "#/$defs/nonEmptyString" },
        "title": { "$ref": "#/$defs/nonEmptyString" },
        "description": { "$ref": "#/$defs/nonEmptyString" },
        "kind": { "enum": ["view", "observe", "effect"] },
        "risk": { "enum": ["reversible", "consequential", "irreversible"] },
        "effect_target": { "enum": ["database", "external"] },
        "required_scopes": {
          "type": "array",
          "items": { "$ref": "#/$defs/nonEmptyString" },
          "uniqueItems": true
        },
        "required_role": {
          "enum": ["visitor", "member", "editor", "owner", "admin"]
        },
        "surfaces": {
          "type": "array",
          "minItems": 1,
          "items": { "enum": ["ui", "guide", "remote"] },
          "uniqueItems": true
        },
        "input_schema": { "$ref": "#/$defs/sourcePath" },
        "output_schema": { "$ref": "#/$defs/sourcePath" },
        "executor": { "$ref": "#/$defs/executor" },
        "effects": {
          "type": "array",
          "items": { "$ref": "#/$defs/nonEmptyString" }
        },
        "concept": {
          "type": "object",
          "required": ["id", "version"],
          "additionalProperties": false,
          "properties": {
            "id": { "$ref": "#/$defs/id" },
            "version": { "$ref": "#/$defs/nonEmptyString" }
          }
        },
        "timeout_seconds": { "type": "integer", "minimum": 1 },
        "recovery": {
          "enum": ["provider-idempotency-key", "reconcile"]
        },
        "cool_off_seconds": { "type": "integer", "minimum": 1 },
        "ui_exception": {
          "type": "object",
          "required": ["reason"],
          "additionalProperties": false,
          "properties": {
            "reason": { "$ref": "#/$defs/nonEmptyString" }
          }
        }
      },
      "allOf": [
        {
          "if": {
            "properties": { "kind": { "const": "view" } },
            "required": ["kind"]
          },
          "then": {
            "properties": {
              "risk": false,
              "effect_target": false,
              "executor": false,
              "timeout_seconds": false,
              "recovery": false,
              "cool_off_seconds": false,
              "surfaces": {
                "type": "array",
                "items": { "enum": ["ui", "guide"] }
              }
            }
          }
        },
        {
          "if": {
            "properties": { "kind": { "const": "observe" } },
            "required": ["kind"]
          },
          "then": {
            "required": ["executor"],
            "properties": {
              "executor": true,
              "risk": false,
              "effect_target": false,
              "timeout_seconds": false,
              "recovery": false,
              "cool_off_seconds": false
            }
          }
        },
        {
          "if": {
            "properties": { "kind": { "const": "effect" } },
            "required": ["kind"]
          },
          "then": {
            "required": ["risk", "effect_target", "executor"],
            "properties": {
              "risk": true,
              "effect_target": true,
              "executor": true
            }
          }
        },
        {
          "if": {
            "properties": { "effect_target": { "const": "external" } },
            "required": ["effect_target"]
          },
          "then": {
            "required": ["timeout_seconds", "recovery"],
            "properties": {
              "timeout_seconds": true,
              "recovery": true
            }
          },
          "else": {
            "properties": {
              "timeout_seconds": false,
              "recovery": false
            }
          }
        },
        {
          "if": {
            "properties": { "risk": { "const": "irreversible" } },
            "required": ["risk"]
          },
          "then": {
            "required": ["cool_off_seconds"],
            "properties": { "cool_off_seconds": true }
          },
          "else": {
            "properties": { "cool_off_seconds": false }
          }
        },
        {
          "if": {
            "properties": {
              "kind": { "const": "effect" },
              "surfaces": {
                "type": "array",
                "not": { "contains": { "const": "ui" } }
              }
            },
            "required": ["kind", "surfaces"]
          },
          "then": {
            "required": ["ui_exception"],
            "properties": {
              "risk": { "const": "reversible" },
              "ui_exception": true
            }
          },
          "else": {
            "properties": { "ui_exception": false }
          }
        }
      ]
    },
    "workflow": {
      "type": "object",
      "required": ["id", "steps"],
      "additionalProperties": false,
      "properties": {
        "id": { "$ref": "#/$defs/id" },
        "steps": {
          "type": "array",
          "minItems": 1,
          "items": {
            "type": "object",
            "required": ["target", "text"],
            "additionalProperties": false,
            "properties": {
              "target": { "$ref": "#/$defs/nonEmptyString" },
              "text": { "$ref": "#/$defs/nonEmptyString" }
            }
          }
        }
      }
    },
    "dependency": {
      "type": "object",
      "required": ["required", "fallback"],
      "additionalProperties": false,
      "properties": {
        "required": { "type": "boolean" },
        "fallback": { "$ref": "#/$defs/nonEmptyString" }
      }
    }
  }
}
